Event Picture Ref No,Event Name,Description,Interest,Start Time,Finish Time,Event Date,End Date,Reapeat,Location,Lat/Lon,Website,Contact Number
Caesers_46.jpg,Temple Pool,"This iconic pool is the classic image of Caesars Palace swimming, an elegant spot with statuary and columns. Lounge chairs surround the round pool, offering some of the most striking views of the Garden of the Gods Pool Oasis, while its two cabanas and 17 day beds offer another level of luxury.Day beds starting from $150 and cabanas from $150.",Pools,9:00:00 AM,5:00:00 PM,31.03.2019,31.10.2019,Everyday,"3500 Las Vegas Blvd. South Las Vegas, 89109",36.117453-115.176688,https://www.caesars.com/caesars-palace/things-to-do/garden-of-the-gods-pool-oasis,702 731 7280 
Caesers_47.jpg,Neptune Pool,"The perfect place to mingle, meet and greet, The Neptune pool is the social hub of the Garden of the Gods. Splash among the beautiful people, get some sun or just relax. The Neptune pool features eight cabanas, 12 day beds and chaise lounge chairs for your enjoyment.Day beds starting from $200 and cabanas from $450.",Pools,9:00:00 AM,5:00:00 PM,31.03.2019,31.10.2019,Everyday,"3500 Las Vegas Blvd. South Las Vegas, 89109",36.117453-115.176688,https://www.caesars.com/caesars-palace/things-to-do/garden-of-the-gods-pool-oasis,702 731 7280 
Caesers_48.jpg,Apollo Pool,"Apollo was the Roman god of light and the sun, so it_s only fitting that this Las Vegas pool suited for sun worship is named after this deity. Positioned at the southwest corridor of the oasis, The Apollo Pool provides maximum sun exposure with five cabanas and four day beds.Lounge chairs starting from $30, day beds from $150 and cabanas from $150.",Pools,9:00:00 AM,5:00:00 PM,31.03.2019,31.10.2019,Everyday,"3500 Las Vegas Blvd. South Las Vegas, 89109",36.117453-115.176688,https://www.caesars.com/caesars-palace/things-to-do/garden-of-the-gods-pool-oasis,702 731 7280 
Caesers_49.jpg,Jupiter Pool,"The Jupiter Pool is secluded in the northwest corner of the Garden of the Gods. Relax your way in one of seven luxurious cabanas.Day beds starting from $50 and cabanas from $150.",Pools,9:00:00 AM,5:00:00 PM,31.03.2019,31.10.2019,Everyday,"3500 Las Vegas Blvd. South Las Vegas, 89109",36.117453-115.176688,https://www.caesars.com/caesars-palace/things-to-do/garden-of-the-gods-pool-oasis,702 731 7280 
Caesers_50.jpg,Fortuna Pool,"The Roman goddess of luck beckons you to try yours at this action-packed pool. Play a few hands of swim-up blackjack or have a bite to eat or visit the Fortuna bar for a refreshing selection of signature mojitos and fresh margaritas.Lounge chairs starting from $15.",Pools,9:00:00 AM,5:00:00 PM,31.03.2019,31.10.2019,Everyday,"3500 Las Vegas Blvd. South Las Vegas, 89109",36.117453-115.176688,https://www.caesars.com/caesars-palace/things-to-do/garden-of-the-gods-pool-oasis,702 731 7280 
Caesers_51.jpg,Bacchus Pool,"Named after the Roman God of wine, this exclusive pool is reserved for invited guests and celebrities. With eight daybeds and eight cabanas, The Bacchus Pool is the perfect place to soak in the sun and enjoy a VIP experience.Day beds starting from $200 and cabanas from $150.",Pools,9:00:00 AM,5:00:00 PM,31.03.2019,31.10.2019,Everyday,"3500 Las Vegas Blvd. South Las Vegas, 89109",36.117453-115.176688,https://www.caesars.com/caesars-palace/things-to-do/garden-of-the-gods-pool-oasis,702 731 7280 
Caesers_52.jpg,Venus European Pool Lounge,"Venus European Pool Lounge is the most well-appointed and exclusive Las Vegas pool experience at the oasis. The sophisticated and secluded European-style retreat offers high-end food and beverage choices for you to indulge in while perfecting your summer tan. All drinks are topped and made with the freshest fruits and ingredients. Light treats include sushi rolls, crisp salads, sandwiches and burgers served straight from the grill.The 10,000-square-foot retreat hosts 14 cabanas, 16 day beds, 10 couches and plenty of chaise lounge chairs. You_ll find the perfect spot to catch rays, people-watch or just take in the lush surroundings.",Pools,9:00:00 AM,5:00:00 PM,31.03.2019,31.10.2019,Everyday,"3500 Las Vegas Blvd. South Las Vegas, 89109",36.117453-115.176688,https://www.caesars.com/caesars-palace/things-to-do/garden-of-the-gods-pool-oasis,702 731 7280 
