Event Picture Ref No,Event Name,Description,Interest,Start Time,End Time,Event Date,End Date,Repeat,Location ,Lat/Long,Website,Contact Number
Stratosphere_15.jpg,Mj Live,"The King of Pop and all of the Hits.Showcasing the pure joy of this legendary superstar and his music including ""Bad,"" ""Billie Jean,"" ""Beat It,"" ""Dangerous,"" ""Smooth Criminal,"" ""Black & White,"" ""Thriller,"" ""Don't Stop Till You Get Enough,"" and many more. Features live band and dancers.Shows at 7pm nightly.Tickets start at $57.50 plus tax and handling. Stratosphere hotel guests receive 25% off. Children 5 years or older can attend. Children must be accompanied by parent or guardian 18 years or older to attend. The use of cameras are allowed during the performance. No flash photography please. No bags will be permitted into the venue except for small purses (8""x8"" max). Backpacks of any size are not allowed. Guests will need to check-in their bags at the bell desk or return prohibited items to their rooms.",Shows,10:00:00 AM,10:00:00 PM,11.01.2019,31.12.2019,"Sun, Mon, Tue, Wed, Thu","2000 S Las Vegas Blvd, Las Vegas, NV 89104","36.147653, -115.156731",https://www.stratospherehotel.com/Entertainment/MJ-LIVE,702 380 7711
Stratosphere_15.jpg,Mj Live,"The King of Pop and all of the Hits.Showcasing the pure joy of this legendary superstar and his music including ""Bad,"" ""Billie Jean,"" ""Beat It,"" ""Dangerous,"" ""Smooth Criminal,"" ""Black & White,"" ""Thriller,"" ""Don't Stop Till You Get Enough,"" and many more. Features live band and dancers.Shows at 7pm nightly.Tickets start at $57.50 plus tax and handling. Stratosphere hotel guests receive 25% off. Children 5 years or older can attend. Children must be accompanied by parent or guardian 18 years or older to attend. The use of cameras are allowed during the performance. No flash photography please. No bags will be permitted into the venue except for small purses (8""x8"" max). Backpacks of any size are not allowed. Guests will need to check-in their bags at the bell desk or return prohibited items to their rooms.",Shows,10:00:00 AM,10:30:00 PM,11.01.2019,31.12.2019,"Fri, Sat","2000 S Las Vegas Blvd, Las Vegas, NV 89104","36.147653, -115.156731",https://www.stratospherehotel.com/Entertainment/MJ-LIVE,702 380 7711
Stratosphere_16.jpg,L.A. Comedy Club,"6pm | Redneck Comedy Magic of James Michael: Wedesday _ MonayJames Michael has taken the suave and sophistication out of your typical Las Vegas magician, and brought it back to its roots, with boots, booze, and bad words. James Michael is a magician/comedian, tattoo artist, fitness model and professional drinking buddy. He is known for his mastery of the unknown and deft sleight of hands, Michael puts on a unique hilarious magic show. He has performed on, TV, cruise ships, corporates, birthday parties, restaurants, UFOs, prisons, strip clubs, hospitals, fairs and yes, even a Chucky Cheese in Southaven, Mississippi. Visit www.redneckcomedymagic.com  for more information about this show.",Shows,6:00:00 PM,8:00:00 PM,11.01.2019,31.12.2019,"Wed, Thu, Fri, Sat, Sun, Mon","2000 S Las Vegas Blvd, Las Vegas, NV 89104","36.147653, -115.156731",https://www.stratospherehotel.com/Entertainment/LA-Comedy-Club,702 380 7711
Stratosphere_16.jpg,L.A. Comedy Club,"L.A. Comedy Club was the first comedy club to bring breakout comics such as Aziz Ansari, Felipe Esparsa and Loni Love to Las Vegas. Each week is a different live comedy event where national headlining comedians can stretch their comedic wings to provide the audience with a unique quality experience that_s funny and relevant. Customers deserve something beyond the norm of the brick wall, and they will get that every night at the L.A. Comedy Club of Las Vegas.See the Stratosphere Ticket Center across from Roxy_s for ticket information. Call 702.380.7711 or visit LaComedyClub.com",Shows,8:00:00 PM,10:00:00 PM,11.01.2019,31.12.2019,Everyday,"2000 S Las Vegas Blvd, Las Vegas, NV 89104","36.147653, -115.156731",https://www.stratospherehotel.com/Entertainment/LA-Comedy-Club,702 380 7711
