Title,Date,Location,Description,ImageURL,User Name,Time_Zone,End_Date,Long_Lat
Beatles LOVE by Cirque du Soleil Magical Technical Tour,03/08/18 01:00 PM,"Cirque du Soleil - The Beatles LOVE - Las Vegas,3400 Las Vegas Blvd S, Las Vegas, NV 89109","Enjoy an Insider Access to a narrated demonstration of The Beatles LOVE which is set to feature the show's technical elements such as:  automation, audio, projections, lighting, rigging, and highlight some of the show's props and wardrobe.  We invite newcomers, hotel guests, locals, and fans into the LOVE Theatre by experiencing the cutting-edge brighter, bolder, and bigger technology behind The Beatles LOVE.\n\nWHEN\nOccurrence:  FRIDAY & SATURDAY*\nTime(s):  1:00pm - 1:30pm**\nDuration:   Approximately 30 mins.\nSeating:  FREE admission and seating is on a first come basis. Plan to arrive 15mins prior to the start of the event.\nLocation:  The Beatles LOVE Theatre, at the Mirage Hotel and Casino, Las Vegas\n\nDISCLAIMER\n*Performance dates & times are subject to change/cancel without notices.\nContact Cirque Internal Ticketing 702-352-0221 for schedule updates.\n**Late Comers:  For the safety of all attendees no late arrivals will be allowed after the start time.\nSpecial Effects:  Strobe lights and theatrical fog will be used during the demos. Guests who react to either of these effects should attend the show at their own risk.\nPhotography:  Is permitted during the demonstration though no video recordings.",https://s3-media2.fl.yelpcdn.com/ephoto/WM_IwGuXjj6AHEKPGL6cpQ/300s.jpg,,PST,04/07/18 01:30 PM,"(36.1204933, -115.1747142)"
Yelp's Game Night at Level Up,04/17/18 05:30 PM,"Level Up Las Vegas - Las Vegas,3799 S Las Vegas Blvd, Las Vegas, NV 89109","Up up down down left right left right B A start! Know what I mean? Then you\'ll fit right in at our next shindig, Yelp\'s Game Night, inside MGM Grand at Level Up! bit.ly/2E63dpQ\n\nNo quarters required here! Just FREE PLAY ALL DAY, or at least a few hours! So unleash your inner child and come play with us! With all that button mashing you\'re going to need something to sustain the stamina, so select Level Up will be serving up pizza, and two complimentary crafty cocktails to quench your thirst!\n\nWe promise this event will bring you a lot of joy(stick)! So RSVP NOW! Must be 21 to play here!\n\nAbout Level Up Las Vegas:\nChanging the way Las Vegas views lounge entertainment, LEVEL UP presents a new era in interactive, skill-based fun. Located between Hakkasan Nightclub and the MGM Grand Race and Sports Book, the tech savvy, adult playground features pay-to-play offerings in a social atmosphere, designed to not only attract the next generation of players, but existing players seeking innovation.\n\nBUT YOU HAVE TO WIN A SPOT TO ATTEND! THIS IS A PRIVATE, INVITE-ONLY EVENT!\n\nTo enter to win an invite, which will be good for you and one guest:\n1. Click ""RSVP"" in the top right corner of this page. (Don\'t see ""RSVP""? Check to see if you are logged in.)\n2. Make sure you have a profile pic (of yourself) and a REAL name on your account/profile.\n\nOther friendly reminders:\n* First round of RSVPs will be confirmed via email 1 week prior to the event. Make sure you\'re Account Settings allow you to receive emails from Yelp.\n* Space is limited. Please await a confirmation email from Yelp to ensure you\'ve won a spot.\n* All guests must be 21+, with proper ID.\n\nQuestions? Message Yelp Las Vegas Community Manager Taylor S via her Yelp profile: taytertalks.yelp.com.",https://s3-media3.fl.yelpcdn.com/ephoto/8RouMgXhMmWd8AeiNvdVwA/300s.jpg,,PST,04/09/18 07:30 PM,"(36.1204933, -115.1747142)"
Las Vegas Restaurant Week,06/18/18 12:00 AM,"Las Vegas Restaurant Week - Las Vegas, NV,Las Vegas, NV","Help out by dining out during Las Vegas Restaurant Week! The annual 12-day culinary event will take place this year from June 18 through June 29.\n\nParticipating restaurants will create prix-fixe menus - some offering breakfast, lunch and/or dinner - at price points ranging from $20 to $80. A fixed portion of the meal's cost will directly support Three Square Food Bank's mission of pursuing a hunger-free community.\n\nA complete list of menus by participating restaurants will be available on HelpOutDineOutLV.org in early June. Follow Las Vegas Restaurant Week on Facebook for the latest updates.",https://s3-media3.fl.yelpcdn.com/ephoto/YbHnzXfjINtfg4-V6ZSnrg/300s.jpg,,PST,06/29/18 11:30 PM,"(36.2362732, -115.0969797)"
29th annual jazz in the park series,05/12/18 12:00 AM,"Clark County Amphitheater - Las Vegas,500 S Grand Central Pkwy, Las Vegas, NV 89106","Clark County Parks and Recreation kicks off summer with their annual Jazz in the Park Concert Series, which celebrates its 29th year. This year, the free series will feature Ghost-Note (featuring Nate and Sput from the multi GRAMMY Award-winning Band Snarky Puppy) on May 12, Bill Frisell feat. Trio Tony Scherr & Kenny Wollesen on May 19, Diane Schuur on May 26, The Groove Project featuring Marcus Anderson, Oli Silk and JJ Sansaverino on June 2 and Mindi Abair & The Boneshakers on June 16. Seating for those with picnic baskets, blankets, and low-back chairs will begin at 5 p.m. with performances beginning as early as 6:30 p.m. at the Clark County Government Center Amphitheater, 500 S. Grand Central Parkway. Food and drinks will be available on site. Admission and parking are free.",https://s3-media4.fl.yelpcdn.com/ephoto/BibCN3cLDfm-nY-zFwc2Nw/300s.jpg,,PST,06/11/18 12:00 AM,"(36.1656918, -115.1530798)"
Monta Chaya Pop Up (New Hours),04/02/18 05:00 PM,"Udon Monzo - Las Vegas,3889 Spring Mountain Rd, Las Vegas, NV 89102","You asked for it, we're bringing it back!! Monta Chaya pop-up restaurant!! Ramen available from 5:00pm ~ 11:00pm at Udon Monzo location!!\nPlease look forward to our new location along with our new menu release!!",https://s3-media2.fl.yelpcdn.com/ephoto/_VllNacs18HH2AFVSLkbvw/300s.jpg,,PST,04/20/18 11:00 PM,"(36.1656918, -115.1530798)"
"Reno Unofficial Yelp Spring Break Save the Date May 17-20, 2018",04/07/18 12:00 AM,"City of Las Vegas - Las Vegas,495 S Main St, Las Vegas, NV 89101","Hey Las Vegas! Spread the word! Reno is excited to host our first Unofficial Yelp Spring Break (UYSB) May 17-20, 2018. Check out all of the great events we have planned including coffees, hikes, happy hours,  breweries, multiple dining opportunities, a ghost tour and a docent tour, and many more. There is literally something for everyone. Go to the ""Official Website"" link at the bottom of this page to see all of the events posted in one place. Click on the links for more information and RSVP with the I\'M IN button or click SOUNDS COOL if you can\'t make it but want to show it some love.\n\nHere is the link to the Facebook group where you can also keep up on some of the activities and discussions. Feel free to add friends who you think may be interested.\n\nfacebook.com/groups/1558",https://s3-media1.fl.yelpcdn.com/ephoto/TAbNbio6J6SyguJHjXgI2w/300s.jpg,,PST,05/07/18 12:00 AM,"(36.1674401, -115.1484325)"
AIDS WALK LAS VEGAS 2018,04/15/18 07:00 AM,"Town Square Las Vegas - Las Vegas,6605 Las Vegas Blvd S, Las Vegas, NV 89119","Attracting more than 3,500 participants annually, AIDS Walk Las Vegas is one of the most visible, longstanding, and recognizable events in the Las Vegas area. People of all ages, races, and backgrounds come together each year in a massive, powerful, and inspiring demonstration of compassion and action. Las Vegas AIDS walk is unique because we offer a 2-hour ""pre-walk"" festival with sponsor tables, top of the line Las Vegas entertainers, silent auction and food & beverage vendors (some offer free items). Join us for the festival (8-10) and then walk (10-11) to show your support. We ask that participants fundraise by getting friends, family, and colleagues to donate towards their goal. The more money a participant donates or raises the more prizes they will earn!",https://s3-media1.fl.yelpcdn.com/ephoto/zNFf6zrLhyhflvWtasrl9A/300s.jpg,,PST,04/09/18 11:00 AM,"(36.06816680000001, -115.1762652)"
Ben & Jerry's Free Cone Day,04/10/18 12:00 PM,"Ben & Jerrys - Las Vegas,3663 Las Vegas Blvd, Las Vegas, NV 89109","Annual Free Cone day!\nPosting this as it's my duty as a exported Vermonter. Most scoop shops will be doing free cone day, so if there's a shop closer to you, check them out and ask in advance for their planned hours. I'll likely be at Red Rock Casino as the crowds are...less.\nNo special orders. No cash.\nSometimes a shop runs a charity fundraiser at the same time, so bring cash for donating if you're feeling giving.",https://s3-media2.fl.yelpcdn.com/ephoto/Sp19dVnaB84MsNMscsIL_w/300s.jpg,,PST,04/09/18 08:00 PM,"(36.1107346, -115.1722379)"
Dita Von Teese,06/28/18 07:30 PM,"House of Blues - Music Venue - Las Vegas,3950 Las Vegas Blvd S, Las Vegas, NV 89119","Absolut Elyx presents\nHeadlining: Dita Von Teese and The Copper Coupe Burlesque\nAges: 18+ only\n\nShow: TBD\nDoors: 7:30 P.M. PST\n\nFor VIP seating upgrades, please fill out a request on the House of Blues website.\n\nHouse of Blues Las Vegas is a carbon neutral venue by Terrapass.",https://s3-media3.fl.yelpcdn.com/ephoto/DLcwcOlcB6xrTaM2wc4ZZA/300s.jpg,,PST,06/29/18 07:30 PM,"(36.093044, -115.175564)"
Great Las Vegas Festival of Beer. $399 Per Couple,04/06/18 12:00 AM,"Park on Fremont - Las Vegas,506 Fremont St, Las Vegas, NV 89101","8th Annual Great Las Vegas Festival of Beer\nMore than 100 breweries. More than 500 craft beers. Cool experiences. Beer-inspired cuisine. It's all part of the 8th Annual Great Vegas Festival of Beer! As part of this special event getaway in amazing Las Vegas, you'll enjoy two unique experiences - the Mad Craft Experience and the Great Vegas Grand Tasting!\n\nThe Mad Craft Experience offers a high-energy, experimental competition combining the world's of craft beer and culinary. The event celebrates craft beers, local brewers, taverns, chefs, and those that push the limits of your palate with both brews and food. You'll enjoy unlimited samples of beer and food! Then, the following day, the Grand Tasting features more than 100 of the world's top craft breweries across three blocks of downtown Las Vegas. Sample more than 500 craft beers and enjoy delicious dishes while enjoying BrewLogic educational sessions, Silent Disco and more.\n\nThis unique festival is all part of an exciting three-night getaway in Las Vegas where you'll enjoy luxury one-bedroom villa accommodations at Westgate Flamingo Bay Resort. Located a short drive from the famed Vegas Strip, Westgate Flamingo Bay features roomy and luxurious villas offering lots of living space and all the creature comforts of home. Your villa features separate sleeping, living and dining areas. Meanwhile, the 10-acre property includes a tropical swimming pool, exquisite landscaping with water displays and many resort amenities such as a practice putting green, barbecue facilities, playground and a fully-equipped fitness center.\n\nYou'll also enjoy VIP check-in. a special dinner with buffet, open bar, DJ, prizes and dancing, as well as late check-out on your final day.",https://s3-media2.fl.yelpcdn.com/ephoto/mdbrwq5RZl3TBjrfTE02Hg/300s.jpg,,PST,04/09/18 12:00 AM,"(36.169269, -115.140157)"
Las Vegas Beer & Brewery Tours,03/31/18 02:30 PM,"Banger Brewing - Las Vegas,450 Fremont St, Las Vegas, NV 89101","Now this is what you call a Beer Adventure! One of our favourite cities also has a rapidly growing 'craft' scene and we welcome you to join us in hitting all 6 of the incredible bars, breweries and taprooms we've picked out for you. Our tour starts in downtown and calls in at 3 great spots within walking distance before it's time to jump in a taxi to the Strip.\n\nThere's some amazing food on offer in most places and with time being of no real significance in Las Vegas we welcome you take this Las Vegas beer tour at your own pace.  In no time at all you'll be enjoying some great local brews from the likes of: Banger Brewing, Sin City Brewing and Tenaya Creek Brewery.\n\nThis is one of our very favourite Beer Adventures, if you're about to start it then have an amazing time!\n\nHOW IT WORKS:\n\nThe Beer Adventures app acts as a magical mystery tour directing beer fans around a city at the touch of a few buttons. Available on iOS and Android, we offer highly curated, built in itineraries in most major cities.",https://s3-media3.fl.yelpcdn.com/ephoto/2yqUboPtm2WqcHuSOLKzMg/300s.jpg,,PST,04/30/18 06:30 PM,"(36.169269, -115.140157)"
Life Is Beautiful Festival,09/21/18 02:00 PM,"Life is Beautiful Festival - Las Vegas,425 Fremont St, Las Vegas, NV 89101","Festival: 2018 Life Is Beautiful\nHeadliners: TBD\nSub-headliners: TBD\nAges: All\n\nTickets: TBA\n\n""GA pass grants you access to the beautiful life! With this wristband, experience the sights and sounds of four stages, taste cuisine in the culinary villages, attend learning sessions and be visually stunned by murals and immersive art installations."" - ticketfly.com",https://s3-media4.fl.yelpcdn.com/ephoto/SVnZ9hkAHHzMJU2MDddXOg/300s.jpg,,PST,09/23/18 11:30 PM,"(36.169269, -115.140157)"
Paul Simon,05/27/18 08:00 PM,"Grand Garden Arena - Las Vegas,3799 Las Vegas Blvd S, Las Vegas, NV 89109","Tour: ""Homeward Bound"" Farewell Tour\nHeadlining: Paul Simon\nDate: Sunday, 27 May 2018 C.E.\n\nShow: 8:00 P.M. PST\nDoors: 7:00 P.M. PST\nAges: All\n\n""During his distinguished career Paul Simon has been the recipient of many honors and awards including 12 Grammy Awards, three of which (\'Bridge Over Troubled Water,\' \'Still Crazy After All These Years\' and \'Graceland\') were albums of the year. In 2003 he was given a Grammy Lifetime Achievement Award for his work as half of the duo Simon and Garfunkel. He is a member of The Songwriters Hall of Fame, a recipient of their Johnny Mercer Award and is in the Rock n\' Roll Hall of Fame as a member of Simon and Garfunkel and as a solo artist. His song \'Mrs. Robinson\' from the motion picture \'The Graduate\' was named in the top ten of The American Film Institute\'s 100 Years 100 Songs."" - axs.com",https://s3-media3.fl.yelpcdn.com/ephoto/4OjUqEP1UiNQpU16UFhRLA/300s.jpg,,PST,05/28/18 08:00 PM,"(36.104313, -115.1685048)"
Hamilton,05/29/18 07:30 PM,"The Smith Center - Las Vegas,361 Symphony Park Ave, Las Vegas, NV 89106","Broadway Series: Hamilton\nTickets: Available Late April 2018\nAges: 5+ only\n\n""Go back to the era of the Founding Fathers with Lin-Manuel Miranda\'s inventive Tony-winning musical, winner of 11 Broadway.com Audience Choice Awards."" - broadway.com",https://s3-media4.fl.yelpcdn.com/ephoto/sApza6i6CAi6tPN91Wpiow/300s.jpg,,PST,06/24/18 10:00 PM,"(36.1688268, -115.1518086)"
Our Big Concert,05/10/18 06:30 PM,"Downtown Las Vegas Events Center - Las Vegas,200 S 3rd St, Las Vegas, NV 89101","Special Event: OBC 2018\nHeadliner: Awolnation\nSupporting: Judah & the Lion, Manchester Orchestra, Sir Sly and Two Feet\nAges: All\n\n""It\'s our biggest (and coolest) OBC ever -- and you\'ve got a shot at tickets before anyone else! Get in today (Wed., Mar. 14) to get your discounted presale tickets to OBC 2018 on May 10 at the Downtown Las Vegas Events Center.""\n\n""Just enter \'OBC2018\' at the link below -- and you\'ll get tickets for just $35. That\'s cheaper than when the rest of the tickets go on sale to the public on Friday.""\n\n""Awolnation, Judah & the Lion, Manchester Orchestra, Sir Sly and Two Feet make up the killer bill. Only a limited number of tix are available at the presale price...so get \'em quick before they\'re gone! See ya May 10!"" - x1075lasvegas.radio.com",https://s3-media2.fl.yelpcdn.com/ephoto/MzniBs9z6HmVa3gqmuoXZQ/300s.jpg,,PST,05/11/18 06:30 PM,"(36.1686667, -115.1446407)"
Runaway with Cirque du Soleil 5K Run,04/14/18 07:00 AM,"Springs Preserve - Las Vegas,333 S Valley View Blvd, Las Vegas, NV 89107","Run or walk with your favorite Cirque du Soleil artists at this annual event that includes music from cast and crew, photo opportunities with performers and a circus play area for children.  This event is presented by Cirque du Soleil in partnership with the Springs Preserve.  All proceeds support the Springs Preserve and Cirque du Soleil Foundations.\n\nEVENT FEATURES:\n5K Competitive Individual and Team Timing. A minimum of 10 participants are required to qualify for Team categories.\nAll participants will also be included in a raffle for prizes including a chance to win show tickets to the Las Vegas Cirque du Soleil shows. Also included are prizes from the Springs Preserve.\nFIT4MOM Stroller Spirit Contest - show your Cirque Side and docorate your running buddy\'s stroller for a chance to win prizes from FIT4MOM.\nMusic by the cast and crew of Cirque du Soleil.\nPhoto opportunities by Cashman Photo with performers from Cirque du Soleil.\nComplimentary massage therapy\nComplimentary refreshments for participants provided by Whole Foods Market.\nFace painting and circus fun play area.\nAccess to the Springs Preserve museums and galleries with race bib.\n\nEVENT INFORMATION\nThis is an all ages event, children under the age of three do not need to register.\n\nAll entries are non-refundable, non-transferable and non-tax deductible.\n\nEVENT PRICING:\nRunning-5K - Adult Individual Age group/open $37.00 in 61 days $40.00\nRunning-5K - Child (Age 3 - 12 yrs) Individual Age group/open $27.00in 61 days $30.00\nWalking-1 Mile - Adult Individual Age group/open $27.00in 61 days $30.00\nWalking-1 Mile - Child (age 3 - 12 yrs) Individual Age group/open $17.00in 61 days $20.00\n\nRACE DAY SCHEDULE\n\n7:00 a.m. Registration opens\n\n7:30 a.m. Pre-race activities and warm-up begin\n\n8:00 a.m. Registration closes\n\n8:30 a.m. Race Start\n\n9:00 a.m. Music followed by Awards Ceremony\n\nDon\'t forget!\n\nBring water and sun block! The Springs Preserve is a smoke and pet free environment.\n\nPARKING is available in the Springs Preserve lots and in the Las Vegas Valley Water District Remote lot located at the northwest corner of Valley View and Alta.  *Please do not park in private business lots who have ""Tow Warning"" signs posted.",https://s3-media3.fl.yelpcdn.com/ephoto/06pfOS2dkGKWLFDBPi0bnw/300s.jpg,,PST,04/09/18 09:00 AM,"(36.1710039, -115.1903572)"
Beatles LOVE by Cirque du Soleil Magical Technical Tour,06/06/18 01:00 PM,"Cirque du Soleil - The Beatles LOVE - Las Vegas,3400 Las Vegas Blvd S, Las Vegas, NV 89109","Enjoy an Insider Access to a narrated demonstration of The Beatles LOVE which is set to feature the show's technical elements such as:  automation, audio, projections, lighting, rigging, and highlight some of the show's props and wardrobe.  We invite newcomers, hotel guests, locals, and fans into the LOVE Theatre by experiencing the cutting-edge brighter, bolder, and bigger technology behind The Beatles LOVE.\n\nWHEN\nOccurrence:  FRIDAY & SATURDAY*\nTime(s):  1:00pm - 1:30pm**\nDuration:   Approximately 30 mins.\nSeating:  FREE admission and seating is on a first come basis. Plan to arrive 15mins prior to the start of the event.\nLocation:  The Beatles LOVE Theatre, at the Mirage Hotel and Casino, Las Vegas\n\nDISCLAIMER\n*Performance dates & times are subject to change/cancel without notices.\nContact Cirque Internal Ticketing 702-352-0221 for schedule updates.\n**Late Comers:  For the safety of all attendees no late arrivals will be allowed after the start time.\nSpecial Effects:  Strobe lights and theatrical fog will be used during the demos. Guests who react to either of these effects should attend the show at their own risk.\nPhotography:  Is permitted during the demonstration though no video recordings.",https://s3-media1.fl.yelpcdn.com/ephoto/cyrBPeJKH8HYs9lyxURbvw/300s.jpg,,PST,07/06/18 01:30 PM,"(36.1206147, -115.1719738)"
Dispatch x Nahko and Medicine for the People at Brooklyn Bowl,08/17/18 06:00 PM,"Brooklyn Bowl - Las Vegas,3545 Las Vegas Blvd S, Las Vegas, NV 89109","DISPATCH\nNAHKO AND MEDICINE FOR THE PEOPLE\n@ BROOKLYN BOWL\nFriday August 17, 2018\n6pm || 18+ || $39.50 - $55.00+\n\n$39.50 general admission. $45 general admission (day of show). $55 club level. $1.00 per ticket to Artist charity.\n\nAll guests must have a valid government issued ID for entry to the venue. No refunds.\n\nTICKETS PURCHASED IN PERSON AT THE BOX OFFICE INCLUDE A $2 BOX OFFICE FEE.\n\nALL TICKET PRICES INCLUDE NEVADA'S 9% LIVE ENTERTAINMENT TAX\n\nAll general admission tickets are standing room only.\n\nOn Sale Friday March 2nd, 2018\nTickets:\nticketfly.com/purchase/e\n\nMore Info:\nbrooklynbowl.com/event/1\n\nLike, Repost & Tag\nAina Roots + Your Frenz\nfor a Chance to Win\nTickets and a Bowling Lane\n\nFollow Aina Roots\non Snapchat, Twitter and FB\nfor Upcoming Show Info +\nChances to Win Concert Tickets",https://s3-media1.fl.yelpcdn.com/ephoto/zbcyiAEZNhQk8mXm_9p_Cg/300s.jpg,,PST,08/18/18 06:00 PM,"(36.1175056, -115.1696207)"
NAB Nail Bar Grand Opening,04/07/18 06:00 PM,"NAB Nail Bar - Las Vegas,8891 W Flamingo Rd, Las Vegas, NV 89147","NAB Nail Bar Announces April 7, 2018, at 6-10 pm Grand Opening New, state-of-the-art nail salon coming to Las Vegas! First salon in Las Vegas offering REAL DIAMOND nail enhancements.\n-----------------\nThis unique nail salon is the first in Las Vegas to offer real diamond nail enhancements. In addition, NAB Nail Bar offers a luxury anti-aging manicure, Golden Girl pedicure, and the exclusive salon to perform the Urea pedicure by LCN in Las Vegas.\n\nThe salon will also offer the best lash services in town via its 10 lash lounges. Each lash artist offers a high level of experience to deliver remarkable results.\n\nNAB Nail Bar uses holistic products to promote clean energy and offers a VIP room for groups, weddings, birthdays, and more.\n\nThe salon features 16 manicure and pedicure chairs, massages, wax services, botox, and microblading. The April 7, 2018 grand opening will feature complimentary manicures, free food, drinks, appetizers and more. More information can be found at nabnailbar.com. The NAB Nail Bar app is now available for iTunes and Google Play.\n---------------\nNAB Nail Bar\n8891 W. Flamingo Rd. Las Vegas, NV 89147\nPhone: 702-919-6763\nE-mail: info@nabnailbar.com",https://s3-media3.fl.yelpcdn.com/ephoto/qJ10iY3_wPTbCRMKq_XGNA/300s.jpg,,PST,04/08/18 06:00 PM,"(36.1175056, -115.1696207)"
St. Jude Walk Run to End Childhood Cancer,09/15/18 07:00 AM,"Town Square Las Vegas - Las Vegas,6605 Las Vegas Blvd S, Las Vegas, NV 89119","The St. Jude Walk Run to End Childhood Cancer is a family-friendly event that raises money to support the life-saving mission on St. Jude Children's Research Hospital. St. Jude is leading the way the world understands, treats, and defeats childhood cancer and life-threatening diseases. Everything we do is focused on  finding cures and saving children.",https://s3-media3.fl.yelpcdn.com/ephoto/rg_7ZWSNjwSgyFuStYDOfw/300s.jpg,,PST,09/16/18 07:00 AM,"(36.06816680000001, -115.1762652)"
