Title,Date,Location,Description,ImageURL,User Name,Time_Zone,End_Date,Long_Lat
Steel Panther,04/06/18 09:00 PM,"House of Blues - Music Venue - Las Vegas,3950 Las Vegas Blvd S, Las Vegas, NV 89119","Special Event: Sunset Strip Live!\nHeadlining: Steel Panther\nSupporting: TBA\nAges: 18+\n\nShow: TBD\nDoors: 9:00 P.M. PST\n\nFor VIP seating upgrades, please fill out a request on the House of Blues website.\n\nHouse of Blues Las Vegas is a carbon neutral venue by Terrapass.\n\n""The title of Steel Panther\'s third full-length album, All You Can Eat, came from a dream.""\n\n""However, it wasn\'t a dream Martin Luther King had or even any of the band members--Michael Starr [lead singer], Satchel [guitarist], Lexxi Foxx [bass], and Stix Zadinia [drums]--for that matter.""\n\n""\'Believe it or not, the title came from a fucking girl that I was fucking,\' admits Satchel. \'She fell asleep next to me on the tour bus. She woke up and told me she had a dream that we called the album, All You Can Eat. She was really hot, and she had great tits. I decided I was going to steal the title from her and not tell her. I kicked her off the bus.  She can\'t do jack shit about it. She\'s probably living in a trailer park somewhere. It\'s a great title though.\'""\n\n""More importantly, that moniker fits this rock \'n\' roll opus like a condom--not that Steel Panther practice or condone safe sex though. No, All You Can Eat is raw, raucous, and righteous heavy metal in its finest form. The Los Angeles quartet upholds the pillars of its sound. There are badass riffs aplenty, arena-size grooves, lyrics about sex, drugs, and senior citizens, and the lingering scent of whisky, a stripper\'s perfume, and hairspray. In order to capture all of this, the band began writing immediately after they got off the road behind their sophomore effort, Balls Out, their second album to debut at #1 on Billboards Comedy Albums Chart.""\n\n""\'We\'ve grown a lot,\' says Michael Starr. \'On the first record, you get a flavor of some Bon Jovi, Mtley Cre, and Def Leppard. On the second, you get a flavor of Guns N\' Roses. On this record, the main flavor is Steel Panther.\'""\n\n""Tasting the Panther, the boys retreated to Clearlake Studios with longtime producer Jay Ruston. Immediately, they got into their groove and went for it balls-to-the-wall.""\n\n""\'I do a lot of my writing while I\'m taking a shit or I\'m in the shower,\' Satchel goes in. \'I\'ll fucking jump in the shower once a week, and it happens. I write it down. Lyrics will be written on a chick\'s back while I\'m fucking her. Then, everybody does his own thing to the song--or the chick--and the song is great. The music really writes itself. You just let the Lord speak through you.\'""\n\n""With a milkman like work ethic, Steel Panther may just be the hardest working men in show business. Their formal debut Feel the Steel also hit #1 on Billboard\'s Top Comedy Albums Chart. They\'ve sold out shows worldwide from Australian to the UK\'s iconic Brixton Academy, as well as appearing on festivals such as Download and Rock on the Range. Historical milestones include being the oldest heavy metal band to snag a major label deal and the only band to consistently play weekly on the Sunset Strip for an unprecedented thirteen years straight. Moreover, rock luminaries ranging from Aerosmith\'s Steven Tyler and KISS\'s Paul Stanley to Slipknot\'s Corey Taylor, Linkin Park\'s Chester Bennington, and Rage Against the Machine\'s Tom Morello have all partied with the Panther on stage. Meanwhile, this fearsome foursome has also appeared on Dancing With the Stars, Bad Girl\'s Club and a web campaign for the big screen adaptation of Rock of Ages.""\n\n""Ultimately though, they\'re not stopping anytime soon. \'Our drive to bring heavy metal back has not lessened,\' concludes Michael Starr. \'It\'s actually gotten stronger. We\'re not going to stop. I look forward to our continued world domination.\'"" - houseofblues.com",https://s3-media1.fl.yelpcdn.com/ephoto/b0vUWGmB0oBNLRjfoMv_EQ/300s.jpg,,PST,04/07/18 09:00 PM,"(36.093044, -115.175564)"
Nevada State College 15th Year Celebration,04/14/18 11:00 AM,"Nevada State College - Henderson,1125 Nevada State Dr, Henderson, NV 89002","Nevada State College will host a community celebration to commemorate the college's accomplishments over the past 15 years and look ahead at the future. Guests are invited to grab a bite to eat, explore the campus through a guided tour, enjoy live entertainment, and partake in various activities outdoors on the plaza.\n\nThis family-friendly celebration is open to the community. Guests are encouraged to RSVP March 31st by visiting nsc.edu/15yearsrsvp.",https://s3-media1.fl.yelpcdn.com/ephoto/u8cxBOe2XC4hXN9FsVZk7A/300s.jpg,,PST,04/09/18 03:00 PM,"(35.98330869999999, -114.9386542)"
Boyz II Men Live in Las Vegas,04/06/18 12:00 AM,"Boyz II Men - Las Vegas,3400 Las Vegas Blvd S, Las Vegas, NV 89109","Boyz II Men\nBoyz II Men remains one of the most iconic R&B groups in history, having redefined popular R&B for fans across all generations. The group's 4 Grammy Awards are just the icing on the cake of their 20-year career. The band has also won 9 American Music Awards, 9 Soul Train Awards, 3 Billboard Awards, and a 2011 MOBO Award for Outstanding Contribution to Music.\n\nThe trio holds the distinction of being the best-selling R&B group of all time, with 60 million albums sold. Now this legendary group is back on the road and you can catch them live in Las Vegas at the Terry Fator Theater at the Mirage Hotel & Casino.\n\nThis exclusive concert getaway also includes 3 nights of luxury at the Westgate Las Vegas Resort & Casino where you'll enjoy spacious Signature Room accommodations.\n\nConveniently located just one block off the famed Las Vegas Strip, the iconic Westgate Las Vegas Resort & Casino offers the perfect Vegas experience. Enjoy an eclectic variety of nightlife, shopping, dining, entertainment and extraordinary casino gaming, plus an extensive list of amenities. The 30-story landmark resort features nearly 3,000 rooms, a 74,000-square-foot casino, the largest sports book in Las Vegas and its very own Las Vegas Monorail station.\n\nYour Las Vegas concert getaway weekend also features a special opening night Welcome Reception, complete with dinner, drinks a DJ and dancing. We'll also provide you with personal concierge services throughout your stay at Westgate and convenient transportation to and from the event.",https://s3-media1.fl.yelpcdn.com/ephoto/7v1Xi84AFZ3Is0U_krl8_g/300s.jpg,,PST,04/09/18 12:00 AM,"(36.121234, -115.174084)"
3LAU,04/07/18 08:00 PM,"Brooklyn Bowl - Las Vegas,3545 Las Vegas Blvd S, Las Vegas, NV 89109","Tour: Ultraviolet Tour\nHeadlining: 3LAU\nSupporting: Flash Gang, 530\nAges: All\n\n""DJ and producer, born January 9, 1991, Syosset, New York, United States. Better known by his stage name 3LAU (pronounced \'Blau\'), is an American progressive house and electro house producer and Ableton performer."" - brooklynbowl.com",https://s3-media2.fl.yelpcdn.com/ephoto/QMRWvcXsNefNMi54ezVeig/300s.jpg,,PST,04/08/18 08:00 PM,"(36.1175056, -115.1696207)"
2018 Junior Achievement Race for Financial Fitness,04/07/18 08:00 AM,"Hooters Casino Hotel Las Vegas - Las Vegas,115 E Tropicana Ave, Las Vegas, NV 89109","Formerly known as Strip on the Strip, the Junior Achievement 4.01K Race for Financial Fitness is a run/walk down Las Vegas Blvd during the month of April in honor of Financial Literacy Awareness Month! All proceeds from this event are going to support over 20,000 students in Southern Nevada as they learn more about financial literacy (how to be smart with your money and credit), how to be ready to join the workforce and how to think like an entrepreneur/business person. The Event consists of a 5k and 1-mile fun run, where participants are encouraged to form teams and walk together! As an added bonus, we will also have a timing station at the 4.01K marker so that participants can log their ""financially fit"" time in addition to their 5K final time. The race Starts/Ends at Hooters Hotel & Casino and runners run down Las Vegas Blvd. Participants receive: race t-shirt, finisher medal, swag bag, and a ticket to the official After Party at the Hooters Hotel & Casino Pool. Whether you are a competitive runner, a 5K newbie, looking for corporate team building activity or just want to have fun with family and friends Junior Achievement of Southern Nevada\'s 4.01K Race for Financial Fitness 5K/1M is for everyone!",https://s3-media2.fl.yelpcdn.com/ephoto/T3NIFv8a9ynqcEd1oy0Opw/300s.jpg,,PST,04/09/18 12:00 PM,"(36.100506, -115.1677344)"
Beatles LOVE by Cirque du Soleil Magical Technical Tour,04/07/18 01:00 PM,"Cirque du Soleil - The Beatles LOVE - Las Vegas,3400 Las Vegas Blvd S, Las Vegas, NV 89109","Enjoy an Insider Access to a narrated demonstration of The Beatles LOVE which is set to feature the show's technical elements such as:  automation, audio, projections, lighting, rigging, and highlight some of the show's props and wardrobe.  We invite newcomers, hotel guests, locals, and fans into the LOVE Theatre by experiencing the cutting-edge brighter, bolder, and bigger technology behind The Beatles LOVE.\n\nWHEN\nOccurrence:  FRIDAY & SATURDAY*\nTime(s):  1:00pm - 1:30pm**\nDuration:   Approximately 30 mins.\nSeating:  FREE admission and seating is on a first come basis. Plan to arrive 15mins prior to the start of the event.\nLocation:  The Beatles LOVE Theatre, at the Mirage Hotel and Casino, Las Vegas\n\nDISCLAIMER\n*Performance dates & times are subject to change/cancel without notices.\nContact Cirque Internal Ticketing 702-352-0221 for schedule updates.\n**Late Comers:  For the safety of all attendees no late arrivals will be allowed after the start time.\nSpecial Effects:  Strobe lights and theatrical fog will be used during the demos. Guests who react to either of these effects should attend the show at their own risk.\nPhotography:  Is permitted during the demonstration though no video recordings.",https://s3-media1.fl.yelpcdn.com/ephoto/itjem9vtMgkVzRW0h0CQ-Q/300s.jpg,,PST,05/07/18 01:30 PM,"(36.1206147, -115.1719738)"
Advance Screening: Truth or Dare,04/10/18 07:00 PM,"Regal Cinemas Red Rock 16 & IMAX - Las Vegas,11011 West Charleston Blvd, Las Vegas, NV 89135","Film: Truth or Dare\nStudio: Universal Pictures\nRating: PG-13\n\nWide Release Date: Friday, 13 April 2018",https://s3-media1.fl.yelpcdn.com/ephoto/kty7A7gpOMakWq8tIvSazg/300s.jpg,,PST,04/11/18 07:00 PM,"(36.1206147, -115.1719738)"
David Byrne,04/18/18 07:30 PM,"The Smith Center - Las Vegas,361 Symphony Park Ave, Las Vegas, NV 89106","Tour: American Utopia Tour 2018\nHeadlining: David Byrne\nSupporting: Mauro Refosco\nAges: 5+\n\nShow: 7:30 P.M. PST\n\n""Grammy and Oscar winning composer, songwriter and singer David Byrne attained legendary status as the founder and lead singer of Talking Heads - and now he is performing at The Smith Center as part of his extensive world tour, coinciding with the March 2018 release of his hotly anticipated new album \'American Utopia.\'""\n\n""Don\'t miss this rare chance to hear Byrne perform songs from his new album, classics from his solo career, plus iconic hits from his career with Talking Heads. A 12-piece band will also join Byrne on stage for a choreographed concert that he calls \'the most ambitious show I\'ve done since the shows that were filmed for (Talking Heads concert film) \'Stop Making Sense.\'\'""\n\n""Every ticket purchased for David Byrne includes a CD of the new album American Utopia, released on 3/9/18. You\'ll receive instructions via email on how to redeem your album shortly after ticket purchase."" - TheSmithCenter.com",https://s3-media4.fl.yelpcdn.com/ephoto/5Nb7EPQdBwnNQRLpjzQ7Dg/300s.jpg,,PST,04/19/18 07:30 PM,"(36.1688268, -115.1518086)"
Viva Las Vegas,04/19/18 10:00 AM,"The Orleans Hotel & Casino - Las Vegas,4500 West Tropicana Ave, Las Vegas, NV 89103","Special Event: 21st Viva Las Vegas Rockabilly Weekend\nHeadliners: The Stray Cats, Jerry Lee Lewis, Duane Eddy\nAges: All\n\nTickets: 35$-300$",https://s3-media2.fl.yelpcdn.com/ephoto/AakQUSWYLPsBY4Hsg8KbUw/300s.jpg,,PST,04/21/18 10:00 PM,"(36.1688268, -115.1518086)"
Beatles LOVE by Cirque du Soleil Magical Technical Tour,05/07/18 01:00 PM,"Cirque du Soleil - The Beatles LOVE - Las Vegas,3400 Las Vegas Blvd S, Las Vegas, NV 89109","Enjoy an Insider Access to a narrated demonstration of The Beatles LOVE which is set to feature the show's technical elements such as:  automation, audio, projections, lighting, rigging, and highlight some of the show's props and wardrobe.  We invite newcomers, hotel guests, locals, and fans into the LOVE Theatre by experiencing the cutting-edge brighter, bolder, and bigger technology behind The Beatles LOVE.\n\nWHEN\nOccurrence:  FRIDAY & SATURDAY*\nTime(s):  1:00pm - 1:30pm**\nDuration:   Approximately 30 mins.\nSeating:  FREE admission and seating is on a first come basis. Plan to arrive 15mins prior to the start of the event.\nLocation:  The Beatles LOVE Theatre, at the Mirage Hotel and Casino, Las Vegas\n\nDISCLAIMER\n*Performance dates & times are subject to change/cancel without notices.\nContact Cirque Internal Ticketing 702-352-0221 for schedule updates.\n**Late Comers:  For the safety of all attendees no late arrivals will be allowed after the start time.\nSpecial Effects:  Strobe lights and theatrical fog will be used during the demos. Guests who react to either of these effects should attend the show at their own risk.\nPhotography:  Is permitted during the demonstration though no video recordings.",https://s3-media4.fl.yelpcdn.com/ephoto/sA-JkPcqrP_2Vvb6l8OVTw/300s.jpg,,PST,06/06/18 01:30 PM,"(36.1204933, -115.1747142)"
2018 Lung Force Expo,04/05/18 08:00 AM,"SpringHill Suites Las Vegas Convention Center - Las Vegas,2989 Paradise Rd, Las Vegas, NV 89109","This special two-day educational event brings together patients, caregivers, and advocates with leading lung health experts to learn about cutting edge treatments, medications, resources and research to fight lung cancer and other lung diseases.\n\nAt the LUNG FORCE Expo you'll find:\nEducational programs for patients and professionals\nDynamic Inspirational Speakers\nExhibitors and supporters\nMaterials and resources\nRelationship Building Opportunities",https://s3-media1.fl.yelpcdn.com/ephoto/BJCOvn0EmTLoXhq2h0zvUg/300s.jpg,,PST,04/06/18 04:30 PM,"(36.135191, -115.155541)"
Wayne Newton,03/27/18 08:00 PM,"Windows At Ballys Las Vegas - Las Vegas,3655 Las Vegas Blvd S, Las Vegas, NV 89109","Residency: Up Close And Personal\nHeadlining: Wayne Newton\nAges: All\n\n""Las Vegas actor, singer and entertainment legend, Mr. Las Vegas Wayne Newton makes his return to the stage after more than five years with his all-new and original production, \'Wayne Newton: Up Close and Personal,\' at the Windows Showroom at Bally\'s Las Vegas.""\n\n""After working since he was just four years old, Newton took some time off to spend with his family and to get his iconic estate \'Casa de Shenandoah\' open for tours. Now, Newton is back with \'Wayne Newton: Up Close and Personal,\' a show unlike any he has ever done before, boasting a compilation of all of his extraordinary talents.""\n\n""Newton sings crowd favorites including the platinum record hit, \'Danke Schoen,\' as well as engages with the audience by answering questions, making for a truly extraordinary experience. His vast musical talents are on display as he plays an assortment of the many instruments he has perfected. Voted Nevada Magazine\'s \'Best Entertainer\' eight years in a row, he has performed more than 30,000 shows in Las Vegas. Newton shares the fantastic stories and videos that were impactful and influential on his legendary 50+ year career.""\n\n""\'I can\'t tell you how thrilled I am to return home to the Las Vegas stage, especially to perform such a personal and unique show. This will be very different and a more intimate show than I\'ve done in the past and I\'m looking forward to interacting with each audience and sharing stories from my life in Las Vegas, some of which I\'ve never told before,\' Newton said."" - caesars.com",https://s3-media3.fl.yelpcdn.com/ephoto/CwHJaB0UU_tV9pGymFYeeg/300s.jpg,,PST,04/17/18 10:00 PM,"(36.1140611, -115.170627)"
HAIM,04/13/18 08:00 PM,"Pearl Concert Theater At Palms Casino Resort - Las Vegas,4321 W Flamingo Rd, Las Vegas, NV 89103",Tour: Sister Sister Sister Tour\nHeadlining: HAIM\nSupporting: Lizzo\nAges: All\n\nShow: 8:00 P.M. PST,https://s3-media1.fl.yelpcdn.com/ephoto/Drp8JlibKrEymE2NjyIFMg/300s.jpg,,PST,04/14/18 08:00 PM,"(36.1141044, -115.1954251)"
Cher,05/02/18 08:00 PM,"Park Theater - Las Vegas,3770 Las Vegas Blvd S, Las Vegas, NV 89109",Residency: Classic Cher\nHeadlining: Cher\nShow: 8:00 P.M. PDT\nAges: All,https://s3-media1.fl.yelpcdn.com/ephoto/b5l9jpW5ctVZe2ZM0-CGMg/300s.jpg,,PST,05/19/18 11:30 PM,"(36.1037049, -115.174848)"
Caifanes,05/04/18 09:00 PM,"House of Blues - Music Venue - Las Vegas,3950 Las Vegas Blvd S, Las Vegas, NV 89119","Headlining: Caifanes\nSupporting: TBA\nAges: 18+\n\nShow: 9:00 P.M. PST\nDoors: 8:00 P.M. PST\n\nFor VIP seating upgrades, please fill out a request on the House of Blues website.\n\nHouse of Blues Las Vegas is a carbon neutral venue by Terrapass.",https://s3-media1.fl.yelpcdn.com/ephoto/bUnsRB_YItFVGmzZPUllCQ/300s.jpg,,PST,05/05/18 09:00 PM,"(36.1037049, -115.174848)"
Mike Love ft. Olivia Thai at Topgolf Las Vegas,05/18/18 08:00 PM,"Topgolf - Las Vegas,4627 Koval Ln, Las Vegas, NV 89109","Mike Love\nOlivia Thai\n@ TOPGOLF LAS VEGAS (THE TOYOTA YARD)\nFriday May 18, 2018\n8pm || 18+ || $15+\n\nAll tickets are Standing Room Only.\n\n21+ Only for VIP tickets. 18+ for GA tickets.\n\nTickets are non refundable.\n\nNon-professional cameras allowed, no detachable lenses.\n\nGuests accept all customary risks associated with live events.\n\nNo outside Food and Beverage allowed into the venue.\n\nPremium Hitting Bays with unobstructed views of the concert are available by contacting LasVegasEvents@Topgolf.c.\n\nLink to Tickets on TicketMaster\nbit.ly/2Ful5fx\n\nInfo @ Topgolf.com\nbit.ly/2Hl7qIe\n\nLike, Repost & Tag\nAina Roots + Your Frenz\nfor a Chance to Win\nTickets\n\nFollow Aina Roots\non Snapchat, Twitter and FB\nfor Upcoming Show Info +\nChances to Win Concert Tickets",https://s3-media4.fl.yelpcdn.com/ephoto/hnJW8-AhwOgWUDRRWwfPzQ/300s.jpg,,PST,05/19/18 08:00 PM,"(36.1037049, -115.174848)"
SOJA at Brooklyn Bowl (18+),05/19/18 07:00 PM,"Brooklyn Bowl - Las Vegas,3545 Las Vegas Blvd S, Las Vegas, NV 89109","SOJA\n@ BROOKLYN BOWL\nSaturday May 19, 2018\n7pm || 18+ || $29.50 - $49.50+\n\n$29.50 general admission. $35 general admission (day of show). $49.50 club level.\n\nAll guests must have a valid government issued ID for entry to the venue. No refunds.\n\nTICKETS PURCHASED IN PERSON AT THE BOX OFFICE INCLUDE A $2 BOX OFFICE FEE.\n\nALL TICKET PRICES INCLUDE NEVADA'S 9% LIVE ENTERTAINMENT TAX\n\nAll general admission tickets are standing room only.\n\nLink to Tickets on TicketFly\nticketfly.com/purchase/e\n\nInfo @ Vegas.BrooklynBowl.com\nbrooklynbowl.com/event/1\n\nLike, Repost & Tag\nAina Roots + Your Frenz\nfor a Chance to Win\nTickets and a Bowling Lane\n\nFollow Aina Roots\non Snapchat, Twitter and FB\nfor Upcoming Show Info +\nChances to Win Concert Tickets",https://s3-media4.fl.yelpcdn.com/ephoto/5RWi3vxD_ERbOp-KdHGd2Q/300s.jpg,,PST,05/20/18 07:00 PM,"(36.1175056, -115.1696207)"
"UB40 w/ Ali Campbell, Astro & Mickey at Brooklyn Bowl (2 Nights)",07/27/18 12:00 AM,"Brooklyn Bowl - Las Vegas,3545 Las Vegas Blvd S, Las Vegas, NV 89109","UB40\nfeaturing Ali Campbell, Astro & Mickey\nFools Rush In Weekend\n@ BROOKLYN BOWL\nFriday July 27, 2018 & Saturday July 28, 2018\n7:30pm || 18+ || $47.50 - $85+\n\n$47.50 general admission. $52 general admission (day of show)\n$75 club level. $85 2-Day Pass\n\nAll guests must have a valid government issued ID for entry to the venue. No refunds.\n\nTICKETS PURCHASED IN PERSON AT THE BOX OFFICE INCLUDE A $2 BOX OFFICE FEE.\n\nALL TICKET PRICES INCLUDE NEVADA'S 9% LIVE ENTERTAINMENT TAX\n\nAll general admission tickets are standing room only.\n\nLink to Tickets on TicketFly\nDay 1:\nbrooklynbowl.com/event/1\nDay 2:\nbrooklynbowl.com/event/1\n2-Day Pass:\nbrooklynbowl.com/event/1\n\nInfo @ Vegas.BrooklynBowl.com\nDay 1:\nticketfly.com/purchase/e\nDay 2:\nticketfly.com/purchase/e\n2-Day Pass:\nticketfly.com/purchase/e\n\nLike, Repost & Tag\nAina Roots + Your Frenz\nfor a Chance to Win\nTickets and a Bowling Lane\n\nFollow Aina Roots\non Snapchat, Twitter and FB\nfor Upcoming Show Info +\nChances to Win Concert Tickets",https://s3-media4.fl.yelpcdn.com/ephoto/CnUxQGwyMCsO8_i4j3FCzA/300s.jpg,,PST,07/29/18 02:00 AM,"(36.1175056, -115.1696207)"
The Decemberists,08/01/18 08:30 PM,"House of Blues - Music Venue - Las Vegas,3950 Las Vegas Blvd S, Las Vegas, NV 89119","Headlining: The Decemberists\nSupporting: Whitney\nAges: All\n\nShow: 8:30 P.M. PDT\nDoors: 7:30 P.M. PDT\n\nFor VIP seating upgrades, please fill out a request on the House of Blues website.\n\nHouse of Blues Las Vegas is a carbon neutral venue by Terrapass.",https://s3-media1.fl.yelpcdn.com/ephoto/gm_PKmPHmBmw-2YfWC9XjA/300s.jpg,,PST,08/02/18 08:30 PM,"(36.093044, -115.175564)"
Jack White,08/23/18 08:00 PM,"The Chelsea - Las Vegas,3708 Las Vegas Blvd S, Las Vegas, NV 89109","Tour: Boarding House Reach tour\nHeadlining: Jack White\nAges: All\n\n""PLEASE NOTE: this is a PHONE-FREE show. No photos, video or audio recording devices allowed."" - ticketmaster.com\n\nTickets: General On-Sale Tuesday, 20 March 2018 C.E. - 1:00 P.M. PDT\n\n""Additionally, tickets for Jack\'s 2018 headline tour go on sale at 10am local time today (01.26.18). Every online ticket purchased for North American shows will include a physical CD copy of Boarding House Reach with the option to upgrade to the standard black vinyl LP."" - jackwhiteiii.com",https://s3-media1.fl.yelpcdn.com/ephoto/mEPfbfNt9Pf-D9ditioOJA/300s.jpg,,PST,08/24/18 11:30 PM,"(36.109786, -115.176767)"
Ozzy Osbourne,10/13/18 08:00 PM,"Grand Garden Arena - Las Vegas,3799 Las Vegas Blvd S, Las Vegas, NV 89109","Tour: No More Tours 2 tour\nHeadlining: Ozzy Osbourne\nSupporting: Stone Sour\nDate: Saturday, 13 October 2018 C.E.\n7:30 P.M.\n\nAges: All",https://s3-media4.fl.yelpcdn.com/ephoto/sGZS-pajZcSb5SahXyTVug/300s.jpg,,PST,10/14/18 08:00 PM,"(36.104313, -115.1685048)"
Andrea Bocelli,12/01/18 08:00 PM,"Grand Garden Arena - Las Vegas,3799 Las Vegas Blvd S, Las Vegas, NV 89109","Tour: November-December 2018 Tour\nHeadlining: Andrea Bocelli\nAges: All\n\nTickets: General On-Sale Monday, 26 March 2018 C.E. - 10:00 A.M. PDT\n\n""Andrea Bocelli\'s November-December 2018 Tour goes on sale Monday March 26th, but FAN CLUB members have early access starting today!""\n\n""Don\'t miss Andrea\'s first career performance in Salt Lake City, his first performance in Pittsburgh in over 20 years, his return to Las Vegas, Phoenix, Dallas, Boston, and back-to-back performances in New York City at Madison Square Garden.""\n\n""Use the code TENOR at the links below to get your tickets today!"" - andreabocelli.com",https://s3-media2.fl.yelpcdn.com/ephoto/idixxWrpkg0E1Fh804u51w/300s.jpg,,PST,12/02/18 08:00 PM,"(36.104313, -115.1685048)"
Remote Viewing Conference,06/03/18 08:00 AM,"South Point Hotel, Casino & Spa - Las Vegas,9777 S Las Vegas Blvd, Las Vegas, NV 89183","Learn and practice Associative Remote Viewing alongside other RV enthusiasts and rub elbows with RV veterans like Joe McMoneagle and Lyn Buchanan.\n\nOther speakers include Dean Radin, Pam Coronado, and Steve Braude.\n\nHosted by Applied Precognition Project. This year's event dovetails with the joint IRVA/SSE conference that starts the very next day at the same hotel.",https://s3-media4.fl.yelpcdn.com/ephoto/tMCJfASyXpE0PLrJ9cUiTA/300s.jpg,,PST,06/05/18 06:00 PM,"(36.0112258, -115.1752403)"
Naked bURN THE LOVERS sea mountain One Love Temple festival Las Vegas dance and day events,03/31/18 09:30 AM,"Sea Mountain One Love Temple - Las Vegas,4400 S Eastern Ave, Las Vegas, NV 89119",Imagine minutes from the Vegas strip the all day and all night clothing optinal party for couples and women as seen just now in Maxim and Esquire Vegas sexiest day. A say of dance and nights of nude pools and days of sunshine and love immersion the event to welcome spring with only the most upcale people,https://s3-media3.fl.yelpcdn.com/ephoto/viw78BF1y6CmdFq-7Rc4bA/300s.jpg,,PST,04/04/18 03:30 AM,"(36.104381, -115.118478)"
