Title,Date,Location,Description,ImageURL,User Name,Time_Zone,End_Date,Long_Lat
Glass Craft and Bead Expo,04/04/18 09:00 AM,"South Point Hotel, Casino & Spa - Las Vegas,9777 S Las Vegas Blvd, Las Vegas, NV 89183","For Immediate Release         Michele Voelkening\nMarch 5, 2018         702-610-4064                                    \n***CALENDAR POSTING***\n24th ANNUAL GLASS CRAFT & BEAD EXPO TO BE HELD\nAT SOUTH POINT HOTEL & CASINO\n\nConvention and Expo is the largest Glass and Bead Expo in the Country\n\nWHAT: The largest glass and bead expo in the country, The Glass Craft & Bead Expo, is returning to South Point Hotel & Casino April 4th through April 8th. The art Expo will feature more than 250 classes taught by professional artists and innovative industry leaders. The Expo also will also offer nearly 160 booths and 70 tabletops in the exhibition hall as well as several artists who will perform live demonstrations in flameworking and other glass art techniques. Glass artists from around the world skilled in stained, fused, mosaics, coldworking, beadmaking, marble making and other torch working will be on hand at the Expo to present their work and teach classes. From Wednesday, April 4th until Sunday, April 8th classes will be held throughout the day. Friday, Saturday and Sunday, April 6th through April 8th, the Expo will be open to the public.\n\nWHEN: Fri., April 6 -  9:00am - 6:00pm\nSat., April 7 -  9:00am - 6:00pm\nSun., April 8 - 10:00am - 3:00pm\n\nClasses begin Wednesday April 4th.The show floor opens Friday, April 6th at 9:00 AM.\n\nPlease note: classes begin Wednesday, April 4th. All students must pre-register.\n\nWHERE: South Point Hotel & Conference Center\n 9777 Las Vegas Blvd. South\n\nCOST:  Admission price:\n$15 per person\n$13 for seniors or military\nDiscount coupons will be available on the website after 3/15/18\n\n \n\nFor more information, and a complete expo lineup, please visit glasscraftexpo.com.",https://s3-media4.fl.yelpcdn.com/ephoto/vZUwJjghmzdON9l3TOec8w/300s.jpg,,PST,,"(36.0112258, -115.1752403)"
Book Signing/West of Hell By Whiskey Emerson,04/07/18 06:00 PM,"Studio 21 Tattoo Gallery - Las Vegas,6020 W Flamingo Rd, Las Vegas, NV 89103","Whiskey Emerson, author of West of Hell will be in the studio signing copies of her recently published book. This is a great opportunity to meet and speak to this amazing author, maybe enjoy a glass of whiskey and a cigar if you're into that sort of thing. We'll have whiskey glasses to give away, raffle prizes and artists will be tattooing images from the book illustrations. One hundred percent of the proceeds from the tattoos will be given to a local charity soon to be announced.\n\nHere's a little something to give you an idea what the book is about.\n\nOne hundred and fifty years ago, New York City was not the city it is today. It was a hellish metropolis, a machine fueled and controlled by political corruption, murder, violence, and extortion. A place where no life was sacred...a place not for the faint of heart.\n\nCopies of the book will be available here at the studio at a discounted price and will be signed by the author. Should be a lot of fun for all you book nerds!!",https://s3-media3.fl.yelpcdn.com/ephoto/q7QYEpXOvVGo_C5cryf15w/300s.jpg,,PST,04/09/18 09:00 PM,"(36.11485529999999, -115.2236054)"
'The Light Dawns;' Come & join us for worship & fellowship @ FCCUCC,04/08/18 09:30 AM,"Ce Palabra Viva - Las Vegas,3415 S Mojave Rd, Las Vegas, NV 89121","Please join us as we journey into the days of Easter with celebration and learning.  We meet inside the Palabra Viva Congregation in one of their meeting rooms.  Stay tuned for sometime in May we will be in our new location(!!) at 2709 Horseshoe Drive, LV, NV 89120.",https://s3-media2.fl.yelpcdn.com/ephoto/TohKqwHbTzebEV2JOiYIdA/300s.jpg,,PST,04/09/18 09:30 AM,"(36.1272138, -115.1058249)"
"Wine, Women & Shoes!",04/15/18 01:00 PM,"Green Valley Ranch Resort & Spa - Henderson,2300 Paseo Verde Pkwy, Henderson, NV 89052","Join us for wine tasting, designer shopping, best in shoe contest, fashion show and more to benefit St. Jude's Ranch for Children!",https://s3-media2.fl.yelpcdn.com/ephoto/ItQTcacRGmYSRO1Et2zd6w/300s.jpg,,PST,04/16/18 01:00 PM,"(36.0209607, -115.09037)"
Hermans Hermits Starring Peter Noone - TixBag,04/27/18 08:00 PM,"Hermans Hermits Starring - Las Vegas, NV,129 East Fremont Street, Las Vegas, NV 89101, USA, Las Vegas, NV 89101","Hermans Hermits is an internationally successful 60s British rock band, from Manchester, England, formed in 1963. Part of the British Invasion, their trademark simple, non-threatening, clean-cut boys next door image made them easier to listen to and more accessible than other British Invasion bands. Their hits include Im Into Something Good, Mrs. Brown, Youve Got a Lovely Daughter, and Im Henry VIII, I Am. Don miss this one night only performance at the Golden Nugget!""",https://s3-media2.fl.yelpcdn.com/ephoto/r-kehzUKBjyDM0rAZ60U7A/300s.jpg,,PST,04/09/18 10:30 PM,"(36.0209607, -115.09037)"
Hermans Hermits Starring Peter Noone - TixBag,04/27/18 08:00 PM,"Golden Nugget - Las Vegas, NV,129 East Fremont Street, Las Vegas, NV 89101, Las Vegas, NV 89101","Herman's Hermits are an English beat rock band, formed in Manchester in 1964. Originally called Herman & The Hermits, they were discovered by Harvey Lisberg, who signed them up to\nmanagement.",https://s3-media3.fl.yelpcdn.com/ephoto/E-rP1JmZW2u49-FmS-aPUQ/300s.jpg,,PST,04/09/18 10:30 PM,"(36.1700166, -115.1447934)"
Fuel the Fight Car Show benefitting Grant a Gift Autism Foundation,05/05/18 11:00 AM,"Gaudin Ford - Las Vegas,6625 Roy Horn Way, Las Vegas, NV 89118","On May 5th, Gaudin Ford will join forces with Team Shelby for the Fuel the Fight Car Show, benefitting Grant a Gift Autism Foundation. Enjoy a complimentary BBQ, the sounds of live DJ spinning the classics, awards, prizes and more.   More than 150 vehicles are expected.\nAdmittance is FREE. Car registration is $10.  Gaudin Ford is located at I-215 and S. Rainbow. For more information, email: carshow@gaudinmotorcompa",https://s3-media4.fl.yelpcdn.com/ephoto/A4jS9-P6mWPJfKf-XnPrRg/300s.jpg,,PST,04/09/18 02:00 PM,"(36.1700166, -115.1447934)"
Learn How to Flip Houses,04/04/18 07:00 PM,"Flipping Females - Las Vegas, NV,1180 N Town Center Drive Suite 100, Las Vegas, NV 89144","We are a group of private real estate investors and we're sharing our success with others. We'll show you how to get started where you are now and how to get where you want to be.  All at your pace with local classes, local mentors and local properties. We are creative in our approach and we even have a group of Flipping Females that are setting this market on fire!! This could change your life!\nOpportunities don't come around like this one very often.  Attend one of our workshops, you'll be impressed. To learn more, get dates and times click here: donnaflorence.theultimat",https://s3-media4.fl.yelpcdn.com/ephoto/_SGc-Xadxlh1C3dhvkM9Rw/300s.jpg,,PST,,"(36.1700166, -115.1447934)"
Gin Blossoms Concert,04/06/18 08:00 PM,"Gin Blossoms Concert - Las Vegas, NV,129 East Fremont Street, Las Vegas, NV 89101","Shaped in 1987 in Tempe, Arizona, the Gin Blossoms are a pop/musical crew known for their southwestern sound and commanding....",https://s3-media4.fl.yelpcdn.com/ephoto/mW1lVEnmNpIXfQPaCJm6dw/300s.jpg,,PST,04/07/18 08:00 PM,"(36.1700166, -115.1447934)"
Tixtm@123,04/06/18 08:00 PM,"The Golden Nugget - Las Vegas, NV,129 East Fremont Street, Las Vegas, NV 89101","Event: Gin Blossoms Concert\nDate:  06 Apr 2018\nTime:  8:00 PM to 10:00 PM\nMin. Ticket Price: $58.00\n\nBooking: tixbag.com/events/perfor\n\nVenue: The Golden Nugget, 129 East Fremont Street, Las Vegas, NV 89101, USA\n\nShaped in 1987 in Tempe, Arizona, the Gin Blossoms are a pop/musical crew known for their southwestern sound and commanding the elective shake period in the \'90s. With hits like ""Hello Jealousy,"" ""Got some answers concerning You"" and ""Tail You Down,"" the Gin Blossoms have earned a few platinum collections and a Grammy nomination. Try not to miss your opportunity to hear Gin Blossom\'s irresistible pop shake melodies!",https://s3-media3.fl.yelpcdn.com/ephoto/Ep-uKXe_itDBiGFtojkeAw/300s.jpg,,PST,04/09/18 10:00 PM,"(36.1700166, -115.1447934)"
"Weekly African Drumming Class in Las Vegas with Master Drummer from Ivory Coast, West Africa",04/06/18 06:30 PM,"Africa Love - Las Vegas,6539 S Las Vegas Blvd, Las Vegas, NV 89119","Weekly African Drum Class in Las Vegas with Master Drummer from Ivory Coast, West Africa\n\nWeekly African drum class at Town Square in Las Vegas with Papa Diarra Zumana, Master Drummer from Ivory Coast, West Africa. papadiarrazumana.com\n\nClass: Every Friday 6:30pm-8pm\n\nLocation: Africa Love (Gift and Decor Store). 6539 Las Vegas Blvd South, C-114, Las Vegas, NV 89119\n(TOWN SQUARE across from Saks 5th Avenue next to Portofino)\n\nAfrica Love Store Facebook page\nfacebook.com/AfricaLove-\n\nPhone: 702-600-5841 or 424-703-0784\n\nCost: $20 per class\n\nDrum Rental Available: $8 per class or bring your own drum\n\nALL AGES AND LEVELS WELCOME!!\n\nPLEASE JOIN OUR FACEBOOK EVENT PAGE HERE:\nfacebook.com/events/1553\n\nCome by anytime and party with us at Africa Love in Town Square!\n\nPLEASE HELP US STAY IN TOUCH WITH YOU!!\nComplete a short African Drum, Dance, Music & Entertainment interest form by following this link:\ngoo.gl/forms/4VWCdNQmsqF...",https://s3-media4.fl.yelpcdn.com/ephoto/jvS47CeywAHFqqafd5s15Q/300s.jpg,,PST,04/09/18 08:00 PM,"(36.1700166, -115.1447934)"
Career Night,04/10/18 04:00 PM,"Keller Williams Realty Southwest - Las Vegas, NV,6180 Brent Thurman Way Suite 100, Las Vegas, NV 89148",Are you looking to start a career in real estate and want to learn more before taking the leap? Join us for this limited time event and get the chance to learn what our industry is all about!,https://s3-media1.fl.yelpcdn.com/ephoto/8Mr6JS81NzFTc7wzfTi8BQ/300s.jpg,,PST,04/11/18 04:00 PM,"(36.076519, -115.287833)"
Career Night,04/11/18 04:00 PM,"Keller Williams Realty Southwest - Las Vegas, NV,6180 Brent Thurman Way, Las Vegas, NV 89148",Are you looking to start a career in real estate and want to learn more before taking the leap? Join us for this limited time event and get the chance to learn what our industry is all about!,https://s3-media4.fl.yelpcdn.com/ephoto/LF2KPv4VhuaMROcKJp9TRg/300s.jpg,,PST,04/09/18 05:00 PM,"(36.076519, -115.287833)"
Justin Timberlake Live in Las Vegas,04/13/18 12:00 AM,"T-Mobile Arena - Las Vegas,3782 Las Vegas Blvd S, Las Vegas, NV 89119","Justin Timberlake\nJustin Timberlake\'s rise to stardom was fast and furious. From The All-New Mickey Mouse Club he ascended to lead singer for NSYNC - one of the best-selling boy bands of all time. He has continued with an equally successful solo career and today boasts an awards collection that includes 10 Grammy Awards, 4 Emmy Awards, 9 Billboard Music Awards and more. Time Magazine has twice names him of the 100 Most Influential People in the World.\n\nNow Timberlake is ready to take his show back on the road with his 2018 ""The Man of the Woods"" tour, a tour featuring a number of songs inspired by the great outdoors and designed to ""bring the outside in.""\n\nDon\'t miss you opportunity to be part of the excitement by catching superstar Justin Timberlake live in concert at T-Mobile Arena in Las Vegas! It\'s all part of an amazing 3-night getaway at the beautiful Westgate Las Vegas Resort & Casino. Seating for the concert will be in the lower bowl.\n\nOne of the hottest tickets in Las Vegas, this amazing event is part of a three-night getaway at the nearby Westgate Las Vegas Resort & Casino where you\'ll enjoy a luxurious signature room. This amazing concert getaway also includes a welcome reception with dinner, open bar, DJ and prizes, personal concierge service, convenient transportation to and from the concert and a late check-out on your final day!\n\nConveniently located just one block off the famed Las Vegas Strip, the iconic Westgate Las Vegas Resort & Casino offers the perfect Vegas experience. Enjoy an eclectic variety of nightlife, shopping, dining, entertainment and extraordinary casino gaming, plus an extensive list of amenities.\n\nThe 30-story landmark resort features nearly 3,000 rooms, a 74,000-square-foot casino, the largest sports book in Las Vegas and its very own Las Vegas Monorail station.",https://s3-media3.fl.yelpcdn.com/ephoto/zVAC7dBBtHMNsPoqzXjCOQ/300s.jpg,,PST,04/16/18 12:00 AM,"(36.1028767, -115.1784324)"
Boyz II Men Live in Las Vegas,04/13/18 12:00 AM,"Boyz II Men - Las Vegas,3400 Las Vegas Blvd S, Las Vegas, NV 89109","Boyz II Men\nBoyz II Men remains one of the most iconic R&B groups in history, having redefined popular R&B for fans across all generations. The group's 4 Grammy Awards are just the icing on the cake of their 20-year career. The band has also won 9 American Music Awards, 9 Soul Train Awards, 3 Billboard Awards, and a 2011 MOBO Award for Outstanding Contribution to Music.\n\nThe trio holds the distinction of being the best-selling R&B group of all time, with 60 million albums sold. Now this legendary group is back on the road and you can catch them live in Las Vegas at the Terry Fator Theater at the Mirage Hotel & Casino.\n\nThis exclusive concert getaway also includes 3 nights of luxury at the Westgate Las Vegas Resort & Casino where you'll enjoy spacious Signature Room accommodations.\n\nConveniently located just one block off the famed Las Vegas Strip, the iconic Westgate Las Vegas Resort & Casino offers the perfect Vegas experience. Enjoy an eclectic variety of nightlife, shopping, dining, entertainment and extraordinary casino gaming, plus an extensive list of amenities. The 30-story landmark resort features nearly 3,000 rooms, a 74,000-square-foot casino, the largest sports book in Las Vegas and its very own Las Vegas Monorail station.\n\nYour Las Vegas concert getaway weekend also features a special opening night Welcome Reception, complete with dinner, drinks a DJ and dancing. We'll also provide you with personal concierge services throughout your stay at Westgate and convenient transportation to and from the event.",https://s3-media2.fl.yelpcdn.com/ephoto/p_hMna_ubrWI7rq4XGsevQ/300s.jpg,,PST,04/16/18 12:00 AM,"(36.121234, -115.174084)"
Celine Dion Live at Caesers Palace,04/13/18 12:00 AM,"The Colosseum At Caesars Palace - Las Vegas,3570 South Las Vegas Blvd, Las Vegas, NV 89109","Celine Dion\nInternational songstress Celine Dion continues to thrill audiences in Las Vegas! Quite possibly the world's most popular female artist, the dynamic superstar, backed by stunning visuals and a full orchestra and band, continues to sell out The Colosseum, a 4,300 seat venue at Caesars Palace.\n\nThe critically acclaimed show features the multi-Grammy-winning performer's amazing repertoire of mega hits and timeless classics, plus a collection of songs from other artists, including Billy Joel, Michael Jackson and Ella Fitzgerald. Always one of the hottest tickets in Las Vegas, you won't want to miss this mesmerizing performance that is part of a three-night getaway at the nearby Westgate Las Vegas Resort & Casino.\n\nConveniently located just one block off the famed Las Vegas Strip, the iconic Westgate Las Vegas Resort & Casino offers the perfect Vegas experience. Enjoy an eclectic variety of nightlife, shopping, dining, entertainment and extraordinary casino gaming, plus an extensive list of amenities.\n\nThe 30-story landmark resort features nearly 3,000 rooms, a 74,000-square-foot casino, the largest sports book in Las Vegas and its very own Las Vegas Monorail station.",https://s3-media4.fl.yelpcdn.com/ephoto/ihd4UNLPno_v8jcdviK_PQ/300s.jpg,,PST,04/16/18 12:00 AM,"(36.1179097, -115.1749868)"
